Country Code,Change,Description of Change,Date Issued,Source
NP,"Deletion of development regions NP-1, NP-2, NP-3, NP-4, NP-5; Change of subdivision name of NP-P4, NP-P6 in nep; Change of subdivision name of NP-P2, NP-P7 in eng and nep; Change of subdivision name of NP-P3 in eng; Addition of location variation for NP-2 in eng and nep; Modification of local variation for NP-P7 in eng and nep; Deletion of zones NP-BA, NP-BH, NP-DH, NP-GA, NP-JA, NP-KA, NP-KO, NP-LU, NP-MA, NP-ME, NP-NA, NP-RA, NP-SA, NP-SE: Update List Source; Modification of remark part 2. (Remark part 2: In September 2015 Nepal created a new federal structure consisting of seven numbered provinces. Six of these provinces have now been named. The remaining province is identified by number only. These provinces have replaced the zones and development regions).",,2022-11-29,Online Browsing Platform (OBP) - https://www.iso.org/obp/ui/#iso:code:3166:NP.
NP,Change of subdivision name of NP-P1; Update List Source.,,2023-11-23,Online Browsing Platform (OBP) - https://www.iso.org/obp/ui/#iso:code:3166:NP.
NR,Name changed: NR-05 Baiti -> Baitsi.,"Change of subdivision name of NR-05; addition of local variation of NR-05, update List Source.",2017-11-23,Online Browsing Platform (OBP) - https://www.iso.org/obp/ui/#iso:code:3166:NR.
NR,Update List Source.,,2015-11-27,Online Browsing Platform (OBP) - https://www.iso.org/obp/ui/#iso:code:3166:NR.
NR,Local generic administrative term addition.,,2011-12-13 (corrected 2011-12-15),Newsletter II-3 - https://www.iso.org/files/live/sites/isoorg/files/archive/pdf/en/iso_3166-2_newsletter_ii-3_2011-12-13.pdf.
NR,Subdivisions added: 14 districts.,Addition of the administrative subdivisions and of their code elements.,2007-04-17,Newsletter I-8 - https://web.archive.org/web/20081218103230/http://www.iso.org/iso/iso_3166-2_newsletter_i-8_en.pdf.
NU,Modification of remark part 2. (Remark part 2: No subdivisions relevant for this standard).,,2018-11-26,Online Browsing Platform (OBP) - https://www.iso.org/obp/ui/#iso:code:3166:NU.
NU,Correct the long name which was incorrect.,,2011-07-14,Online Browsing Platform (OBP) - https://www.iso.org/obp/ui/#iso:code:3166:NU.
NU,Correct the long name which was incorrect.,,2011-06-12,Online Browsing Platform (OBP) - https://www.iso.org/obp/ui/#iso:code:3166:NU.
NZ,Subdivisions added: NZ-CIT Chatham Islands Territory.,"Addition of the country code prefix as the first code element, addition of names in administrative languages, update of the administrative structure and of the list source.",2010-06-30,Newsletter II-2 - https://www.iso.org/files/live/sites/isoorg/files/archive/pdf/en/iso_3166-2_newsletter_ii-2_2010-06-30.pdf.
NZ,Change subdivision category of NZ-AUK.,,2014-11-03,Online Browsing Platform (OBP) - https://www.iso.org/obp/ui/#iso:code:3166:NZ.
NZ,"Deletion of all unitary authorities; deletion of islands NZ-N, NZ-S; Change of subdivision name of NZ-GIS, NZ-MBH, NZ-NSN, NZ-TAS, change of subdivision category from regional council to region; update List Source.",,2015-11-27,Online Browsing Platform (OBP) - https://www.iso.org/obp/ui/#iso:code:3166:NZ.
NZ,Subdivision changed: NZ-AUK.,Deletion of the space before the dash of NZ-AUK in mri.,2023-11-23,Online Browsing Platform (OBP) - https://www.iso.org/obp/ui/#iso:code:3166:NZ.
NZ,"Change of subdivision name of NZ-AUK, NZ-BOP, NZ-STL, NZ-GIS, NZ-HKB, NZ-NTL, NZ-WTC in mri; Change of subdivision name of NZ-WGN, NZ-MWT in eng and mri; Addition of subdivision name for NZ-WKO in eng; Addition of subdivision name for NZ-TAS in mri; Update List Source.",,2022-11-29,Online Browsing Platform (OBP) - https://www.iso.org/obp/ui/#iso:code:3166:NZ.
NZ,Correction of the Code Source.,,2020-11-24,Online Browsing Platform (OBP) - https://www.iso.org/obp/ui/#iso:code:3166:NZ.
OM,"Change of subdivision category from region to governate for OM-BA, OM-DA, OM-SH, OM-WU, OM-ZA; change of subdivision code from OM-BA to OM-BJ, from OM-SH to OM-SJ; change of spelling of OM-BJ, OM-SJ; addition of governorates OM-BS, OM-SS; addition of local variations of OM-MA, OM-ZU; update List Source.",,2015-11-27,Online Browsing Platform (OBP) - https://www.iso.org/obp/ui/#iso:code:3166:OM.
OM,Subdivisions added: OM-BU Al Buraymī. Codes: OM-JA Al Janūbīyah -> OM-ZU Z̧ufār.,Update of the administrative structure and of the list source.,2010-06-30,Newsletter II-2 - https://www.iso.org/files/live/sites/isoorg/files/archive/pdf/en/iso_3166-2_newsletter_ii-2_2010-06-30.pdf.
PA,Change of spelling of subdivision name of PA-NB; Update List Source.,,2022-11-29,Online Browsing Platform (OBP) - https://www.iso.org/obp/ui/#iso:code:3166:PA.
PA,Addition of indigenous region PA-NT; Update List Source.,,2021-11-25,Online Browsing Platform (OBP) - https://www.iso.org/obp/ui/#iso:code:3166:PA.
PA,"Change of subdivision name of PA-KY; addition of local variation of PA-KY, update List Source.",,2017-11-23,Online Browsing Platform (OBP) - https://www.iso.org/obp/ui/#iso:code:3166:PA.
PA,Add 1 province PA-10; update List Source.,,2014-11-03,Online Browsing Platform (OBP) - https://www.iso.org/obp/ui/#iso:code:3166:PA.
PA,Subdivisions added: PA-EM Emberá. PA-NB Ngöbe-Buglé. Codes: PA-0 Comarca de San Blas -> PA-KY Kuna Yala.,Update of the administrative structure and of the list source.,2010-06-30,Newsletter II-2 - https://www.iso.org/files/live/sites/isoorg/files/archive/pdf/en/iso_3166-2_newsletter_ii-2_2010-06-30.pdf.
PE,Correction of the Code Source.,,2020-11-24,Online Browsing Platform (OBP) - https://www.iso.org/obp/ui/#iso:code:3166:PE.
PE,Change Subdivision categories from department and constitutional province to region; update List Source.,,2014-11-03,Online Browsing Platform (OBP) - https://www.iso.org/obp/ui/#iso:code:3166:PE.
PE,Subdivision added: PE-LMA Municipalidad Metropolitana de Lima.,Update of the administrative structure and languages and update of the list source.,2010-06-30,Newsletter II-2.
PF,Delete the Clipperton Island.,,2007-09-21,Online Browsing Platform (OBP) - https://www.iso.org/obp/ui/#iso:code:3166:PF.
PF,Modification of remark part 2. (Remark part 2: No subdivisions relevant for this standard. Included also as a subdivision of France (FR-PF)).,,2018-11-26,Online Browsing Platform (OBP) - https://www.iso.org/obp/ui/#iso:code:3166:PF.
PG,Subdivisions added: PG-HLA Hela. PG-JWK Jiwaka. Name changed: PG-SAN Sandaun [West Sepik] -> West Sepik.,Add two provinces PG-HLA and PG-JWK; change subdivision name of PG-SAN; update List Source.,2014-11-03,Online Browsing Platform (OBP) - https://www.iso.org/obp/ui/#iso:code:3166:PG.
PG,Add 'the' before the English full name.,,2014-03-03,Online Browsing Platform (OBP) - https://www.iso.org/obp/ui/#iso:code:3166:PG.
PG,UN notification of full name.,,2013-05-10,Online Browsing Platform (OBP) - https://www.iso.org/obp/ui/#iso:code:3166:PG.
PG,Codes: PG-NSA North Solomons (province) -> PG-NSB Bougainville (autonomous region).,"Administrative readjustment, local generic administrative term addition and source list and source code update.",2011-12-13 (corrected 2011-12-15),Newsletter II-3 - https://www.iso.org/files/live/sites/isoorg/files/archive/pdf/en/iso_3166-2_newsletter_ii-3_2011-12-13.pdf.
PH,Subdivision deleted: PH-MAG Maguindanao. Subdivisions added: PH-MGN Maguindanao del Norte. PH-MGS Maguindanao del Sur.,"Deletion of province PH-MAG; Addition of province PH-MGN, PH-MGS.",2023-11-23,Online Browsing Platform (OBP) - https://www.iso.org/obp/ui/#iso:code:3166:PH.
PH,Subdivisions renamed: PH-COM Compostela Valley -> Davao de Oro.,Change of subdivision name of PH-COM in eng; Deletion of subdivision name of PH-COM in tgl; Update List Source; Correction of the Code Source.,2020-11-24,Online Browsing Platform (OBP) - https://www.iso.org/obp/ui/#iso:code:3166:PH.
PH,Subdivisions added: PH-DVO Davao Occidental.,Addition of province PH-DVO.,2015-11-27,Online Browsing Platform (OBP) - https://www.iso.org/obp/ui/#iso:code:3166:PH.
PH,Subdivisions added: PH-40 Calabarzon. PH-41 Mimaropa. PH-DIN Dinagat Islands. Subdivisions deleted: PH-04 Southern Tagalog.,"Addition of the country code prefix as the first code element, addition of names in administrative languages, update of the administrative structure and of the list source.",2010-06-30,Newsletter II-2 - https://www.iso.org/files/live/sites/isoorg/files/archive/pdf/en/iso_3166-2_newsletter_ii-2_2010-06-30.pdf.
PH,Subdivisions added: PH-13 Caraga. PH-APA Apayao. PH-BIL Biliran. PH-COM Compostela Valley. PH-GUI Guimaras. PH-SAR Sarangani. PH-ZSI Zamboanga Sibugay. Codes: Cordillera Administrative Region: PH-13 -> PH-15.,Addition of one region and six provinces. New list source and code source. Precise specification of and minor corrections to the spelling of names.,2002-05-21,Newsletter I-2 - https://web.archive.org/web/20120131102127/http://www.iso.org/iso/iso_3166-2_newsletter_i-2_en.pdf.
PK,Addition of romanization system for urd.,,2015-11-27,Online Browsing Platform (OBP) - https://www.iso.org/obp/ui/#iso:code:3166:PK.
PK,Codes: PK-NW North-West Frontier -> PK-KP Khyber Pakhtunkhwa. PK-NA Northern Areas -> PK-GB Gilgit-Baltistan.,"Name change, language readjustment and source list update.",2011-12-13 (corrected 2011-12-15),Newsletter II-3 - https://www.iso.org/files/live/sites/isoorg/files/archive/pdf/en/iso_3166-2_newsletter_ii-3_2011-12-13.pdf.
PK,Deletion of territory PK-TA; Update List Source.,,2019-11-22,Online Browsing Platform (OBP) - https://www.iso.org/obp/ui/#iso:code:3166:PK.
PK,Correction of the Code Source.,,2020-11-24,Online Browsing Platform (OBP) - https://www.iso.org/obp/ui/#iso:code:3166:PK.
PK,"Change of spelling of category name from ilaqa to ‘alāqahilaqa, from suba to sūbah, from wafaqi dar-ul-hakumat ka ilaqa to wafāqī dār al ḩikūmat ‘alāqah; change of subdivision name of PK-JK (eng & urd); addition of local variation of PK-JK in eng; update List Source.",,2017-11-23,Online Browsing Platform (OBP) - https://www.iso.org/obp/ui/#iso:code:3166:PK.
PL,Name changes: 04 Kujawsko-pomorskie -> Kujawsko-Pomorskie. 28 Warmińsko-mazurskie -> Warmińsko-Mazurskie.,"Change of spelling of PL-04, PL-28; Update Code Source and List Source.",2023-11-23,Online Browsing Platform (OBP) - https://www.iso.org/obp/ui/#iso:code:3166:PL.
PL,Category change: province -> voivodship. Code changes: DS -> 02. KP -> 04. LB -> 08. LD -> 10. LU -> 06. MA -> 12. MZ -> 14. OP -> 16. PD -> 20. PK -> 18. PM -> 22. SK -> 26. SL -> 24. WN -> 28. WP -> 30. ZP -> 32.,"Change of category name from province to voivodship in eng and from région to voïvodie in fra; Change of subdivision code from PL-DS to PL-02, PL-KP to PL-04, PL-LB to PL-08, PL-LD to PL-10, PL-LU to PL-06, PL-MA to PL-12, PL-MZ to PL-14, PL-OP to PL-16, PL-PD to PL-20, PL-PK to PL-18, PL-PM to PL-22, PL-SK to PL-26, PL-SL to PL-24, PL-WN to PL-28, PL-WP to PL-30 and PL-ZP to PL-32; Update List Source; Update Code Source.",2018-11-26,Online Browsing Platform (OBP) - https://www.iso.org/obp/ui/#iso:code:3166:PL.
PL,Alphabetical re-ordering and source list update.,,2011-12-13 (corrected 2011-12-15),Newsletter II-3 - https://www.iso.org/files/live/sites/isoorg/files/archive/pdf/en/iso_3166-2_newsletter_ii-3_2011-12-13.pdf.
PL,Subdivision layout: 49 provinces -> 16 provinces.,Introduction of a completely new subdivision layout.,2000-06-21,Newsletter I-1 - https://www.iso.org/files/live/sites/isoorg/files/archive/pdf/en/iso_3166-2_newsletter_i-1_en.pdf.
PM,Modification of remark part 2. (Remark part 2: No subdivisions relevant for this standard. Included also as a subdivision of France (FR-PM)).,,2018-11-26,Online Browsing Platform (OBP) - https://www.iso.org/obp/ui/#iso:code:3166:PM.
PN,Modification of remark part 2. (Remark part 2: No subdivisions relevant for this standard).,,2018-11-26,Online Browsing Platform (OBP) - https://www.iso.org/obp/ui/#iso:code:3166:PN.
PR,Modification of remark part 2. (Remark part 2: No subdivisions relevant for this standard. Included also as a subdivision of the United States (US-PR)).,,2018-11-26,Online Browsing Platform (OBP) - https://www.iso.org/obp/ui/#iso:code:3166:PR.
PS,"Addition of romanization system for ara; change of spelling of category name in ara; change of spelling of PS-QQA, PS-JRH, PS-RBH; update List Source.",,2015-11-27,Online Browsing Platform (OBP) - https://www.iso.org/obp/ui/#iso:code:3166:PS.
PS,UN notification of full name.,,2013-02-06,Online Browsing Platform (OBP) - https://www.iso.org/obp/ui/#iso:code:3166:PS.
PS,Subdivisions added: 16 governorates.,Administrative division taken into account.,2011-12-13 (corrected 2011-12-15),Newsletter II-3 - https://www.iso.org/files/live/sites/isoorg/files/archive/pdf/en/iso_3166-2_newsletter_ii-3_2011-12-13.pdf.
PS,Correction of local name.,,2008-04-08,Online Browsing Platform (OBP) - https://www.iso.org/obp/ui/#iso:code:3166:PS.
PS,New entry (no codes).,Insertion of a new entry between PUERTO RICO and PORTUGAL; in accordance with ISO 3166-1 Newsletter V-2.,2002-08-20,Newsletter I-3 - https://web.archive.org/web/20081218103236/http://www.iso.org/iso/iso_3166-2_newsletter_i-3_en.pdf.
PT,Update List Source.,,2014-11-03,Online Browsing Platform (OBP) - https://www.iso.org/obp/ui/#iso:code:3166:PT.
PT,Update List Source.,,2015-11-27,Online Browsing Platform (OBP) - https://www.iso.org/obp/ui/#iso:code:3166:PT.
PW,Name changed: PW-050 Hatobohei -> Hatohobei.,"Change of spelling of PW-050 in eng, pau; update list source.",2016-11-15,Online Browsing Platform (OBP) - https://www.iso.org/obp/ui/#iso:code:3166:PW.
PW,Subdivisions added: 16 states.,Addition of the administrative subdivisions and of their code elements.,2007-04-17,Newsletter I-8 - https://web.archive.org/web/20120330105926/http://www.iso.org/iso/iso_3166-2_newsletter_i-8_en.pdf.
QA,Addition of municipality QA-SH.,,2017-11-23,Online Browsing Platform (OBP) - https://www.iso.org/obp/ui/#iso:code:3166:QA.
QA,Subdivisions added: QA-ZA Az̧ Za̧`āyin. Subdivisions deleted: QA-GH Al Ghuwayrīyah. QA-JU Al Jumaylīyah. QA-JB Jarīyān al Bāţnah.,"Update resulting from the addition of names in administrative languages, and update of the administrative structure and of the list source.",2011-12-13 (corrected 2011-12-15),Newsletter II-3 - https://www.iso.org/files/live/sites/isoorg/files/archive/pdf/en/iso_3166-2_newsletter_ii-3_2011-12-13.pdf.
RE,Modification of remark part 2. (Remark part 2: No subdivisions relevant for this standard. Included also as a subdivision of France (FR-974)).,,2022-11-29,Online Browsing Platform (OBP) - https://www.iso.org/obp/ui/#iso:code:3166:RE.
RE,Modification of remark part 2. (Remark part 2: No subdivisions relevant for this standard. Included also as a subdivision of France (FR-974)).,,2018-11-26,Online Browsing Platform (OBP) - https://www.iso.org/obp/ui/#iso:code:3166:RE.
RE,Delete the French scattered Indian Ocean Islands.,,2007-09-21,Online Browsing Platform (OBP) - https://www.iso.org/obp/ui/#iso:code:3166:RE.
RO,Update List Source.,,2015-11-27,Online Browsing Platform (OBP) - https://www.iso.org/obp/ui/#iso:code:3166:RO.
RO,Update List Source.,,2014-11-03,Online Browsing Platform (OBP) - https://www.iso.org/obp/ui/#iso:code:3166:RO.
RO,Subdivisions added: RO-IF Ilfov.,Addition of one department. Subdivision categories in header re-sorted.,2002-12-10,Newsletter I-4 - https://web.archive.org/web/20081218103210/http://www.iso.org/iso/iso_3166-2_newsletter_i-4_en.pdf.
RO,Correction of spelling mistake of subdivision category in header.,,2000-06-21,Newsletter I-1 - https://www.iso.org/files/live/sites/isoorg/files/archive/pdf/en/iso_3166-2_newsletter_i-1_en.pdf.
RS,"Subdivisions added: 1 city, 2 autonomous republics, 29 districts.",Addition of a new country (in accordance with ISO 3166-1 Newsletter V-12).,2007-04-17,Newsletter I-8 - https://web.archive.org/web/20120330105926/http://www.iso.org/iso/iso_3166-2_newsletter_i-8_en.pdf.
RS,"Addition of the country code prefix as the first code element, administrative update.",,2010-02-03 (corrected 2010-02-19),Newsletter II-1 - https://www.iso.org/files/live/sites/isoorg/files/archive/pdf/en/iso_3166-2_newsletter_ii-1_corrected_2010-02-19.pdf.
RS,Correction of the romanization system label.,,2018-11-26,Online Browsing Platform (OBP) - https://www.iso.org/obp/ui/#iso:code:3166:RS.
RS,"Addition of an asterisk to RS-KM, RS-VO; Correction of the Code Source.",,2020-11-24,Online Browsing Platform (OBP) - https://www.iso.org/obp/ui/#iso:code:3166:RS.
RS,Alignment of the French short name lower case with UNTERM.,,2014-12-18,Online Browsing Platform (OBP) - https://www.iso.org/obp/ui/#iso:code:3166:RS.
RU,"Correction of language from 'urd' to 'rus' for RU-PSK, RU-ROS, RU-PRI.",,2021-11-25,Online Browsing Platform (OBP) - https://www.iso.org/obp/ui/#iso:code:3166:RU.
RU,Correction of the romanization system label.,,2018-11-26,Online Browsing Platform (OBP) - https://www.iso.org/obp/ui/#iso:code:3166:RU.
RU,Subdivisions added: RU-ZAB Zabaykal'skiy kray. Subdivisions deleted: RU-CHI Chitinskaya oblast'. RU-AGB Aginskiy Buryatskiy avtonomnyy okrug. RU-UOB Ust'-Ordynskiy Buryatskiy avtonomnyy okrug.,Update of the administrative structure and of the list source.,2010-06-30,Newsletter II-2 - https://www.iso.org/files/live/sites/isoorg/files/archive/pdf/en/iso_3166-2_newsletter_ii-2_2010-06-30.pdf.
RU,Subdivisions added: RU-KAM Kamchatskiy kray. Subdivisions deleted: RU-KAM Kamchatskaya oblast'. RU-EVE Evenkiyskiy avtonomnyy okrug. RU-KOR Koryakskiy avtonomnyy okrug. RU-TAY Taymyrskiy avtonomnyy okrug.,"Update and use of long forms of country names as given in Draft NL I-8 538, 22-02-2007 and formation of Permskiy kray after amalgamation.",2007-11-28,Newsletter I-9 - https://www.iso.org/files/live/sites/isoorg/files/archive/pdf/en/newsletter_i-9.pdf.
RU,Subdivisions added: RU-PER Permskiy kray. Subdivisions deleted: RU-PER Permskaya oblast'. RU-KOP Komi-Permyatskiy avtonomnyy okrug.,Modification of the administrative structure.,2007-04-17,Newsletter I-8 - https://web.archive.org/web/20120330105926/http://www.iso.org/iso/iso_3166-2_newsletter_i-8_en.pdf.
RU,Add local language name to the title Khanty-Mansiyskiy avtonomnyy okrug. Update of list source.,,2005-09-13,Newsletter I-7 - https://web.archive.org/web/20081218103217/http://www.iso.org/iso/iso_3166-2_newsletter_i-7_en.pdf.
RU,Introduction of alternative name forms for 2 republics. Correction of a spelling mistake in the name of 1 autonomous district.,,2000-06-21,Newsletter I-1 - https://www.iso.org/files/live/sites/isoorg/files/archive/pdf/en/iso_3166-2_newsletter_i-1_en.pdf.
RW,"Subdivision layout: 12 prefectures -> 1 town council, 4 provinces.",Modification of the administrative structure.,2007-04-17,Newsletter I-8 - https://web.archive.org/web/20120330105926/http://www.iso.org/iso/iso_3166-2_newsletter_i-8_en.pdf.
RW,Change of subdivision category from town council to city; change of spelling of category name in kin.,,2016-11-15,Online Browsing Platform (OBP) - https://www.iso.org/obp/ui/#iso:code:3166:RW.
RW,"Change of spelling of RW-01, RW-02, RW-03, RW-04, RW-05; addition of category name in kin; update List Source.",,2015-11-27,Online Browsing Platform (OBP) - https://www.iso.org/obp/ui/#iso:code:3166:RW.
SA,Alphabetical re-ordering.,,2011-12-13 (corrected 2011-12-15),Newsletter II-3 - https://www.iso.org/files/live/sites/isoorg/files/archive/pdf/en/iso_3166-2_newsletter_ii-3_2011-12-13.pdf.
SA,Change of subdivision category from province to region.,,2018-11-26,Online Browsing Platform (OBP) - https://www.iso.org/obp/ui/#iso:code:3166:SA.
SA,"Change subdivision names of SA-02, SA-03 and SA-09; update List Source.",,2014-11-03,Online Browsing Platform (OBP) - https://www.iso.org/obp/ui/#iso:code:3166:SA.
SB,Modification of the French short name lower case.,,2019-02-15,Online Browsing Platform (OBP) - https://www.iso.org/obp/ui/#iso:code:3166:SB.
SB,Update List Source.,,2015-11-27,Online Browsing Platform (OBP) - https://www.iso.org/obp/ui/#iso:code:3166:SB.
SB,Alignment of the English short name lower case with UNTERM.,,2014-12-18,Online Browsing Platform (OBP) - https://www.iso.org/obp/ui/#iso:code:3166:SB.
SB,Update List Source.,,2014-11-03,Online Browsing Platform (OBP) - https://www.iso.org/obp/ui/#iso:code:3166:SB.
SB,Subdivisions added: SB-CH Choiseul. SB-RB Rennell and Bellona.,Modification of the administrative structure.,2007-04-17,Newsletter I-8 - https://web.archive.org/web/20120330105926/http://www.iso.org/iso/iso_3166-2_newsletter_i-8_en.pdf.
SC,Subdivisions added: SC-24 Les Mamelles. SC-25 Roche Caiman.,Update of the administrative structure and languages and update of the list source.,2010-06-30,Newsletter II-2 - https://www.iso.org/files/live/sites/isoorg/files/archive/pdf/en/iso_3166-2_newsletter_ii-2_2010-06-30.pdf.
SC,Subdivisions added: SC-26 Ile Perseverance I. SC-27 Ile Perseverance II.,"Addition of district SC-26, SC-27; Update List Source.",2020-11-24,Online Browsing Platform (OBP) - https://www.iso.org/obp/ui/#iso:code:3166:SC.
SC,Correct the local language code for the local short name.,,2013-02-06,Online Browsing Platform (OBP) - https://www.iso.org/obp/ui/#iso:code:3166:SC.
SC,Subdivisions added: 23 districts.,Addition of the administrative subdivisions and of their code elements.,2007-04-17,Newsletter I-8 - https://web.archive.org/web/20120330105926/http://www.iso.org/iso/iso_3166-2_newsletter_i-8_en.pdf.
SD,Subdivisions deleted: SD-10 Gharb Kurdufān.,Modification of administrative structure.,2007-11-28,Newsletter I-9 - https://www.iso.org/files/live/sites/isoorg/files/archive/pdf/en/newsletter_i-9.pdf.
SD,Correct numeric code after split.,,2011-08-09,Online Browsing Platform (OBP) - https://www.iso.org/obp/ui/#iso:code:3166:SD.
SD,Subdivision layout: 25 states -> 17 states. Subdivisions deleted: 10 states (SD-14 – SD-23) seceded to create South Sudan (SS). Subdivisions added: SD-DE Sharq Dārfūr. SD-DC Zalingei.,Administrative adjustment and update.,2011-12-13 (corrected 2011-12-15),Newsletter II-3 - https://www.iso.org/files/live/sites/isoorg/files/archive/pdf/en/iso_3166-2_newsletter_ii-3_2011-12-13.pdf.
SD,"Subdivision added: SD-GK Gharb Kurdufān (ar), West Kordofan (en). Spelling changes: SD-DC Zalingei -> Wasaţ Dārfūr Zālinjay. SD-DN ? -> Shamāl Dārfūr. SD-KN Shamāl Kurdufān -> Shiamāl Kurdufān. SD-NO ? -> Ash Shamālīyah. SD-NR An Nīl -> Nahr an Nīl.","Additions of state SD-GK; change spelling of SD-NR, SD-NO, SD-DN, SD-KN, SD-DC; update List Source.",2015-11-27,Online Browsing Platform (OBP) - https://www.iso.org/obp/ui/#iso:code:3166:SD.
SD,Correction of the romanization system label.,,2018-11-26,Online Browsing Platform (OBP) - https://www.iso.org/obp/ui/#iso:code:3166:SD.
SD,Spelling changes: SD-DC Wasaţ Dārfūr Zālinjay -> Wasaţ Dārfūr. SD-KN Shiamāl Kurdufān -> Shamāl Kurdufān.,"Typographical correction of subdivision name of SD-KN, SD-DC; Addition of local variation of SD-DC.",2020-11-24,Online Browsing Platform (OBP) - https://www.iso.org/obp/ui/#iso:code:3166:SD.
SE,"Name precision of the administrative division, Alphabetical re-ordering and source list update.",,2011-12-13 (corrected 2011-12-15),Newsletter II-3 - https://www.iso.org/files/live/sites/isoorg/files/archive/pdf/en/iso_3166-2_newsletter_ii-3_2011-12-13.pdf.
SG,Subdivisions added: 5 districts.,Addition of administrative divisions and their codes.,2007-11-28,Newsletter I-9 - https://www.iso.org/files/live/sites/isoorg/files/archive/pdf/en/newsletter_i-9.pdf.
SH,Subdivisions added: 3 geographical entities.,Administrative subdivisions addition.,2011-12-13 (corrected 2011-12-15),Newsletter II-3 - https://www.iso.org/files/live/sites/isoorg/files/archive/pdf/en/iso_3166-2_newsletter_ii-3_2011-12-13.pdf.
SH,Consistency between ISO 3166-1 and ISO 3166-2 for change of name (in accordance with ISO 3166-1 Newsletter VI-7).,,2010-06-30,Newsletter II-2 - https://www.iso.org/files/live/sites/isoorg/files/archive/pdf/en/iso_3166-2_newsletter_ii-2_2010-06-30.pdf.
SH,Change of name; Addition of islands given in Clauses 9 and 10.,,2010-02-22,Online Browsing Platform (OBP) - https://www.iso.org/obp/ui/#iso:code:3166:SH.
SI,Subdivision layout: 12 statistical regions -> 193 municipalities.,Replacement of statistical regions with 193 municipalities.,2002-12-10,Newsletter I-4 - https://web.archive.org/web/20081218103210/http://www.iso.org/iso/iso_3166-2_newsletter_i-4_en.pdf.
SI,Addition of official language names for some municipalities.,,2005-09-13,Newsletter I-7 - https://web.archive.org/web/20081218103217/http://www.iso.org/iso/iso_3166-2_newsletter_i-7_en.pdf.
SI,Subdivisions added: SI-195 Apače. SI-196 Cirkulane. SI-207 Gorje. SI-197 Kostanjevica na Krki. SI-208 Log-Dragomer. SI-198 Makole. SI-199 Mokronog-Trebelno. SI-200 Poljčane. SI-209 Rečica ob Savinji. SI-201 Renče-Vogrsko. SI-202 Središče ob Dravi. SI-203 Straža. SI-204 Sveta Trojica v Slovenskih goricah. SI-210 Sveti Jurij v Slovenskih goricah. SI-205 Sveti Tomaž. SI-211 Šentrupert. SI-206 Šmarješke Toplice.,Update of the administrative structure and languages and update of the list source,2010-06-30,Newsletter II-2 - https://www.iso.org/files/live/sites/isoorg/files/archive/pdf/en/iso_3166-2_newsletter_ii-2_2010-06-30.pdf.
SI,Add 1 commune SI-212; update List Source.,,2014-11-03,Online Browsing Platform (OBP) - https://www.iso.org/obp/ui/#iso:code:3166:SI.
SI,"Correction of spelling for SI-065, SI-116, SI-169, SI-182, SI-204, SI-210; Deletion of asterisk from SI-212; Update List Source.",,2020-11-24,Online Browsing Platform (OBP) - https://www.iso.org/obp/ui/#iso:code:3166:SI.
