Country Code,Change,Description of Change,Date Issued,Source
AD,Update List Source.,,2015-11-27,Online Browsing Platform (OBP) - https://www.iso.org/obp/ui/#iso:code:3166:AD.
AD,Update List Source.,,2014-11-03,Online Browsing Platform (OBP) - https://www.iso.org/obp/ui/#iso:code:3166:AD.
AD,Subdivisions added: 7 parishes.,Addition of the administrative subdivisions and of their code elements.,2007-04-17,Newsletter I-8 - https://web.archive.org/web/20120330105926/http://www.iso.org/iso/iso_3166-2_newsletter_i-8_en.pdf.
AE,"Change of spelling of AE-AJ, AE-RK; addition of local variation of AE-FU, AE-RK, AE-UQ; update List Source.",,2015-11-27,Online Browsing Platform (OBP) - https://www.iso.org/obp/ui/#iso:code:3166:AE.
AE,Error correction: Spelling correction in AE-AZ.,,2002-08-20,Newsletter I-3 - https://web.archive.org/web/20081218103236/http://www.iso.org/iso/iso_3166-2_newsletter_i-3_en.pdf.
AE,Spelling correction in AE-RK.,,2002-05-21,Newsletter I-2 - https://web.archive.org/web/20081218103157/http://www.iso.org/iso/iso_3166-2_newsletter_i-2_en.pdf.
AF,Correction of the Code Source.,,2020-11-24,Online Browsing Platform (OBP) - https://www.iso.org/obp/ui/#iso:code:3166:AF.
AF,Correction of the romanization system label.,,2018-11-26,Online Browsing Platform (OBP) - https://www.iso.org/obp/ui/#iso:code:3166:AF.
AF,Correction of the local short name; change romanization system; change of spelling of categories of pus and fas; change of spelling of AF-KNR; update List Source.,,2015-11-27,Online Browsing Platform (OBP) - https://www.iso.org/obp/ui/#iso:code:3166:AF.
AF,Codes: AF-LOW Lowgar -> AF-LOG Lōgar. AF-ORU Orūzgān -> AF-URU Uruzgān.,"Language corrections, administrative name corrections, alphabetical re-ordering and source list update.",2011-12-13 (corrected 2011-12-15),Newsletter II-3 - https://www.iso.org/files/live/sites/isoorg/files/archive/pdf/en/iso_3166-2_newsletter_ii-3_2011-12-13.pdf.
AF,Subdivisions added: AF-DAY Dāykondī. AF-PAN Panjshīr.,Addition of 2 provinces. Update of list source.,2005-09-13,Newsletter I-7 - https://web.archive.org/web/20081218103217/http://www.iso.org/iso/iso_3166-2_newsletter_i-7_en.pdf.
AF,Subdivisions added: AF-KHO Khowst. AF-NUR Nūrestān.,Addition of 2 provinces. Update of list source.,2004-03-08,Newsletter I-6 - https://web.archive.org/web/20081218103224/http://www.iso.org/iso/iso_3166-2_newsletter_i-6_en.pdf.
AG,"Subdivisions added: 6 parishes, 1 dependency.",Addition of the administrative subdivisions and of their code elements.,2007-04-17,Newsletter I-8 - https://web.archive.org/web/20081218103230/http://www.iso.org/iso/iso_3166-2_newsletter_i-8_en.pdf.
AG,Change spelling of AG-04.,,2014-10-29,Online Browsing Platform (OBP) - https://www.iso.org/obp/ui/#iso:code:3166:AG.
AG,Subdivisions added: AG-11 Redonda.,Update of the administrative structure and of the list source.,2010-06-30,Newsletter II-2 - https://www.iso.org/files/live/sites/isoorg/files/archive/pdf/en/iso_3166-2_newsletter_ii-2_2010-06-30.pdf.
AI,Modification of remark part 2. (Remark part 2: No subdivisions relevant for this standard).,,2018-11-26,Online Browsing Platform (OBP) - https://www.iso.org/obp/ui/#iso:code:3166:AI.
AL,Correction of the Code Source.,,2020-11-24,Online Browsing Platform (OBP) - https://www.iso.org/obp/ui/#iso:code:3166:AL.
AL,Change of subdivision category from préfecture to comté in French; deletion of all districts; update List Source.,,2015-11-27,Online Browsing Platform (OBP) - https://www.iso.org/obp/ui/#iso:code:3166:AL.
AL,Separation of the variant local short names by semi-colon.,,2014-04-03,Online Browsing Platform (OBP) - https://www.iso.org/obp/ui/#iso:code:3166:AL.
AL,Codes: format changed (leading digit 0 added).,Addition of the country code prefix as the first code element.,2010-02-03 (corrected 2010-02-19),Newsletter II-1 - https://www.iso.org/files/live/sites/isoorg/files/archive/pdf/en/iso_3166-2_newsletter_ii-1_corrected_2010-02-19.pdf.
AL,Change of generic term for administrative divisions. New list source.,,2004-03-08,Newsletter I-6 - https://web.archive.org/web/20081218103224/http://www.iso.org/iso/iso_3166-2_newsletter_i-6_en.pdf.
AL,Subdivisions added: 12 prefectures (now called counties). Codes: AL-LA Laç -> AL-KB Kurbin.,Introduction of 12 prefectures with their code elements. One district name and its code element changed. One district name corrected. Attribution of the prefecture code element to each district.,2002-05-21,Newsletter I-2 - https://web.archive.org/web/20081218103157/http://www.iso.org/iso/iso_3166-2_newsletter_i-2_en.pdf.
AM,Correction of the romanization system label.,,2018-11-26,Online Browsing Platform (OBP) - https://www.iso.org/obp/ui/#iso:code:3166:AM.
AO,"Change spelling of AO-CNO, AO-CUS, and AO-CCU; update List Source.",,2014-10-29,Online Browsing Platform (OBP) - https://www.iso.org/obp/ui/#iso:code:3166:AO.
AO,Correct spelling of AO-CNO and AO-CUS.,,2014-12-18,Online Browsing Platform (OBP) - https://www.iso.org/obp/ui/#iso:code:3166:AO.
AO,Spelling correction in AO-ZAI.,,2002-05-21,Newsletter I-2 - https://web.archive.org/web/20081218103157/http://www.iso.org/iso/iso_3166-2_newsletter_i-2_en.pdf.
AO,Update List Source.,,2015-11-27,Online Browsing Platform (OBP) - https://www.iso.org/obp/ui/#iso:code:3166:AO.
AO,"Change of spelling of AO-CCU, AO-CNO, AO-CUS, AO-LNO, AO-LSU; Addition of local variation for AO-CCU, AO-CNO, AO-CUS; Update List Source.",,2020-11-24,Online Browsing Platform (OBP) - https://www.iso.org/obp/ui/#iso:code:3166:AO.
AO,Correct spelling of AO-CCU.,,2015-02-12,Online Browsing Platform (OBP) - https://www.iso.org/obp/ui/#iso:code:3166:AO.
AQ,Modification of remark part 2. (Remark part 2: No subdivisions relevant for this standard).,,2018-11-26,Online Browsing Platform (OBP) - https://www.iso.org/obp/ui/#iso:code:3166:AQ.
AR,Typographical correction of a name and update of the list and code sources.,,2010-06-30,Newsletter II-2 - https://www.iso.org/files/live/sites/isoorg/files/archive/pdf/en/iso_3166-2_newsletter_ii-2_2010-06-30.pdf.
AS,Modification of remark part 2. (Remark part 2: No subdivisions relevant for this standard. Included also as a subdivision of the United States (US-AS)).,,2018-11-26,Online Browsing Platform (OBP) - https://www.iso.org/obp/ui/#iso:code:3166:AS.
AT,Change of subdivision category from federal Länder to state; update List Source.,,2015-11-27,Online Browsing Platform (OBP) - https://www.iso.org/obp/ui/#iso:code:3166:AT.
AT,Update List Source.,,2014-11-03,Online Browsing Platform (OBP) - https://www.iso.org/obp/ui/#iso:code:3166:AT.
AU,Update List Source; update Code Source.,,2016-11-15,Online Browsing Platform (OBP) - https://www.iso.org/obp/ui/#iso:code:3166:AU.
AU,Update List Source.,,2015-11-27,Online Browsing Platform (OBP) - https://www.iso.org/obp/ui/#iso:code:3166:AU.
AU,Codes: New South Wales: AU-NS -> AU-NSW. Queensland: AU-QL -> AU-QLD. Tasmania: AU-TS -> AU-TAS. Victoria: AU-VI -> AU-VIC. Australian Capital Territory: AU-CT -> AU-ACT.,Change of subdivision code in accordance with Australian Standard AS 4212-1994.,2004-03-08,Newsletter I-6 - https://web.archive.org/web/20081218103224/http://www.iso.org/iso/iso_3166-2_newsletter_i-6_en.pdf.
AW,Modification of remark part 2. (Remark part 2: No subdivisions relevant for this standard. Included also as subdivision of Netherlands (NL-AW)).,,2018-11-26,Online Browsing Platform (OBP) - https://www.iso.org/obp/ui/#iso:code:3166:AW.
AW,Addition of the alpha 3 administrative language code pap.,,2016-11-15,Online Browsing Platform (OBP) - https://www.iso.org/obp/ui/#iso:code:3166:AW.
AW,Addition of code to align ISO 3166-1 and ISO 3166-2.,,2011-12-13 (corrected 2011-12-15),Newsletter II-3 - https://www.iso.org/files/live/sites/isoorg/files/archive/pdf/en/iso_3166-2_newsletter_ii-3_2011-12-13.pdf.
AX,Correct administrative languages.,,2011-06-12,Online Browsing Platform (OBP) - https://www.iso.org/obp/ui/#iso:code:3166:AX.
AX,Correct administrative languages.,,2011-07-14,Online Browsing Platform (OBP) - https://www.iso.org/obp/ui/#iso:code:3166:AX.
AX,Modification of remark part 2. (Remark part 2: No subdivisions relevant for this standard).,,2018-11-26,Online Browsing Platform (OBP) - https://www.iso.org/obp/ui/#iso:code:3166:AX.
AZ,Deletion of the romanization system; update List Source.,,2015-11-27,Online Browsing Platform (OBP) - https://www.iso.org/obp/ui/#iso:code:3166:AZ.
AZ,Subdivisions added: AZ-KAN Kǝngǝrli. AZ-NV Naxçıvan (municipality). Subdivisions deleted: AZ-SS Şuşa. Codes: AZ-AB Əli Bayramlı -> AZ-SR Şirvan. AZ-DAV Dəvəçi -> AZ-SBN Şabran. AZ-XAN Xanlar -> AZ-GYG Göygöl.,"Alphabetical re-ordering, name change of administrative places, first level prefix addition and source list update.",2011-12-13 (corrected 2011-12-15),Newsletter II-3 - https://www.iso.org/files/live/sites/isoorg/files/archive/pdf/en/iso_3166-2_newsletter_ii-3_2011-12-13.pdf.
AZ,Codes: Naxçıvan: AZ-MM -> AZ-NX.,Correction of one code and four spelling errors. Notification of the rayons belonging to the autonomous republic.,2002-05-21,Newsletter I-2 - https://web.archive.org/web/20081218103157/http://www.iso.org/iso/iso_3166-2_newsletter_i-2_en.pdf.
BA,Correction of the romanization system label.,,2018-11-26,Online Browsing Platform (OBP) - https://www.iso.org/obp/ui/#iso:code:3166:BA.
BA,Correction of the romanization system label.,,2018-11-22,Online Browsing Platform (OBP) - https://www.iso.org/obp/ui/#iso:code:3166:BA.
BA,Deletion of all cantons BA-01 to BA-10.,,2015-11-27,Online Browsing Platform (OBP) - https://www.iso.org/obp/ui/#iso:code:3166:BA.
BA,Correct typographic error for the language code for Croatian.,,2010-12-15,Online Browsing Platform (OBP) - https://www.iso.org/obp/ui/#iso:code:3166:BA.
BA,Subdivisions added: BA-BRC Brčko Distrikt.,"Addition of the country code prefix as the first code element, addition of names in administrative languages, update of the administrative structure and of the list source.",2010-06-30,Newsletter II-2 - https://www.iso.org/files/live/sites/isoorg/files/archive/pdf/en/iso_3166-2_newsletter_ii-2_2010-06-30.pdf.
BA,Subdivisions added: 10 cantons.,Second edition of ISO 3166-2 (this change was not announced in a newsletter) - 'Statoid Newsletter January 2008' - http://www.statoids.com/n0801.html.,2007-12-13,ISO 3166-2:2007 - http://www.iso.org/iso/iso_catalogue/catalogue_tc/catalogue_detail.htm?csnumber=39718.
BB,Update List Source.,,2015-11-27,Online Browsing Platform (OBP) - https://www.iso.org/obp/ui/#iso:code:3166:BB.
BB,Update List Source.,,2014-11-03,Online Browsing Platform (OBP) - https://www.iso.org/obp/ui/#iso:code:3166:BB.
BB,Subdivisions added: 11 parishes.,Addition of the administrative subdivisions and of their code elements.,2007-04-17,Newsletter I-8 - https://web.archive.org/web/20081218103230/http://www.iso.org/iso/iso_3166-2_newsletter_i-8_en.pdf.
BD,Subdivisions added: BD-F Rangpur (division). Codes: Barisal (division): BD-1 -> BD-A Chittagong (division): BD-2 -> BD-B Dhaka (division): BD-3 -> BD-C Khulna (division): BD-4 -> BD-D Rajshahi (division): BD-5 -> BD-E Sylhet (division): BD-6 -> BD-G.,"Country name romanization adjustment, first level prefix addition, deletion of generic terms, addition of administrative division and source list update.",2011-12-13 (corrected 2011-12-15),Newsletter II-3 - https://www.iso.org/files/live/sites/isoorg/files/archive/pdf/en/iso_3166-2_newsletter_ii-3_2011-12-13.pdf.
BD,Subdivisions added: BD-6 Sylhet bibhag. Subdivisions deleted: 21 regions .,New list source. One division added. 31 regions cancelled. Allocation of districts to divisions instead of regions. Correction of one spelling error.,2002-05-21,Newsletter I-2 - https://web.archive.org/web/20081218103157/http://www.iso.org/iso/iso_3166-2_newsletter_i-2_en.pdf.
BD,Correct local short name and align with ISO 3166-2.,,2012-02-15,Online Browsing Platform (OBP) - https://www.iso.org/obp/ui/#iso:code:3166:BD.
BD,Correction of the romanization system label.,,2018-11-26,Online Browsing Platform (OBP) - https://www.iso.org/obp/ui/#iso:code:3166:BD.
BD,"Change of spelling of BD-03, BD-06, BD-08, BD-10, BD-22, BD-A, BD-B; Addition of local variation for BD-10, BD-B; Correction of the Code Source.",,2020-11-24,Online Browsing Platform (OBP) - https://www.iso.org/obp/ui/#iso:code:3166:BD.
BD,"Change of spelling of BD-24, BD-25, BD-29, BD-45; change of parent subdivision of BD-21, BD-34, BD-41, BD-55, BD-57; addition of parent subdivision BD-H; addition of an asterisk to divisions; update list source.",,2016-11-15,Online Browsing Platform (OBP) - https://www.iso.org/obp/ui/#iso:code:3166:BD.
BE,Addition of the parent subdivisions.,,2015-11-27,Online Browsing Platform (OBP) - https://www.iso.org/obp/ui/#iso:code:3166:BE.
BE,"First level prefix addition, change of administrative languages and list source update.",,2011-12-13 (corrected 2011-12-15),Newsletter II-3 - https://www.iso.org/files/live/sites/isoorg/files/archive/pdf/en/iso_3166-2_newsletter_ii-3_2011-12-13.pdf.
BF,Spelling change: BF-TUI Tui -> Tuy.,Change of spelling of BF-TUI; update list source.,2016-11-15,Online Browsing Platform (OBP) - https://www.iso.org/obp/ui/#iso:code:3166:BF.
BF,Correction of the short name lowercase in French.,,2014-04-15,Online Browsing Platform (OBP) - https://www.iso.org/obp/ui/#iso:code:3166:BF.
BF,Subdivisions added: 13 regions.,Update of the administrative structure and of the list source.,2010-06-30,Newsletter II-2 - https://www.iso.org/files/live/sites/isoorg/files/archive/pdf/en/iso_3166-2_newsletter_ii-2_2010-06-30.pdf.
BG,Add the second romanized local name for Bulgaria.,,2011-06-12,Online Browsing Platform (OBP) - https://www.iso.org/obp/ui/#iso:code:3166:BG.
BG,Subdivision layout: 9 regions -> 28 regions.,"New subdivision layout: Nine regions with former names (two remaining with former code). Ten regions with new names. New references for list source, code source and romanization system.",2002-05-21,Newsletter I-2 - https://web.archive.org/web/20081218103157/http://www.iso.org/iso/iso_3166-2_newsletter_i-2_en.pdf.
BG,Application of the romanization system 26 October 2006.,,2007-11-28,Newsletter I-9 - https://www.iso.org/files/live/sites/isoorg/files/archive/pdf/en/newsletter_i-9.pdf.
BG,Local country name romanization system adjustment and source list update.,,2011-12-13 (corrected 2011-12-15),Newsletter II-3 - https://www.iso.org/files/live/sites/isoorg/files/archive/pdf/en/iso_3166-2_newsletter_ii-3_2011-12-13.pdf.
BG,Add the second romanized local name for Bulgaria.,,2011-07-14,Online Browsing Platform (OBP) - https://www.iso.org/obp/ui/#iso:code:3166:BG.
BG,Addition of romanization system.,,2015-11-27,Online Browsing Platform (OBP) - https://www.iso.org/obp/ui/#iso:code:3166:BG.
BG,Change of subdivision category from region to district in eng and fra; update List Source.,,2018-04-20,Online Browsing Platform (OBP) - https://www.iso.org/obp/ui/#iso:code:3166:BG.
BG,Correction of the romanization system label.,,2018-11-26,Online Browsing Platform (OBP) - https://www.iso.org/obp/ui/#iso:code:3166:BG.
BG,Alignment with ISO 3166-2 of the local short name Alignment with ISO 3166-2 of the local short name.,,2013-02-06,Online Browsing Platform (OBP) - https://www.iso.org/obp/ui/#iso:code:3166:BG.
BH,Change of subdivision name for BH-13; deletion of a governorate BH-16; update List Source.,,2015-11-27,Online Browsing Platform (OBP) - https://www.iso.org/obp/ui/#iso:code:3166:BH.
BH,Subdivision layout: 12 regions -> 5 governorates.,Modification of the administrative structure.,2007-04-17,Newsletter I-8 - https://web.archive.org/web/20081218103230/http://www.iso.org/iso/iso_3166-2_newsletter_i-8_en.pdf.
BI,Correction of the Code Source.,,2020-11-24,Online Browsing Platform (OBP) - https://www.iso.org/obp/ui/#iso:code:3166:BI.
BI,Subdivision added: BI-RM Rumonge.,Addition of one province BI-RM; update List Source.,2015-11-27,Online Browsing Platform (OBP) - https://www.iso.org/obp/ui/#iso:code:3166:BI.
BI,Subdivisions added: BI-BM Bujumbura Mairie. BI-BL Bujumbura Rural. Subdivisions deleted: BI-BJ Bujumbura.,Update of the administrative structure and of the list source.,2010-06-30,Newsletter II-2 - https://www.iso.org/files/live/sites/isoorg/files/archive/pdf/en/iso_3166-2_newsletter_ii-2_2010-06-30.pdf.
BI,Subdivisions added: BI-MW Mwaro.,Addition of one province.,2002-12-10,Newsletter I-4 - https://web.archive.org/web/20081218103210/http://www.iso.org/iso/iso_3166-2_newsletter_i-4_en.pdf.
BJ,"Change of spelling of BJ-AK, BJ-KO; update List Source.",,2015-11-27,Online Browsing Platform (OBP) - https://www.iso.org/obp/ui/#iso:code:3166:BJ.
BJ,Correction of the Code Source.,,2020-11-24,Online Browsing Platform (OBP) - https://www.iso.org/obp/ui/#iso:code:3166:BJ.
BJ,Subdivisions added: BJ-AL Alibori. BJ-CO Collines. BJ-DO Donga. BJ-KO Kouffo. BJ-LI Littoral. BJ-PL Plateau.,New subdivision layout: 12 departments. Six with previous names and six with new names.,2002-05-21,Newsletter I-2 - https://web.archive.org/web/20120131102127/http://www.iso.org/iso/iso_3166-2_newsletter_i-2_en.pdf.
BL,Correction of the OBP entry error as follows: deletion of “Saint-Barthélemy” in the French name field for Territory.,,2015-02-26,Online Browsing Platform (OBP) - https://www.iso.org/obp/ui/#iso:code:3166:BL.
BL,Add new entry.,,2007-09-21,Online Browsing Platform (OBP) - https://www.iso.org/obp/ui/#iso:code:3166:BL.
BL,Addition of new entry (in accordance with ISO 3166-1 Newsletter VI-1).,,2007-11-28,Newsletter I-9 - https://www.iso.org/files/live/sites/isoorg/files/archive/pdf/en/newsletter_i-9.pdf.
BL,Modification of remark part 2. (Remark part 2: No subdivisions relevant for this standard. Included also as subdivision of France (FR-BL)).,,2018-11-26,Online Browsing Platform (OBP) - https://www.iso.org/obp/ui/#iso:code:3166:BL.
BL,Correction to Newsletter VI-1.,,2008-04-08,Online Browsing Platform (OBP) - https://www.iso.org/obp/ui/#iso:code:3166:BL.
BM,Modification of remark part 2. (Remark part 2: No subdivisions relevant for this standard).,,2018-11-26,Online Browsing Platform (OBP) - https://www.iso.org/obp/ui/#iso:code:3166:BM.
BN,Spelling change: BN-BM Brunei-Muara -> Brunei dan Muara (ms).,Change of subdivision name of BN-BM; Update List Source.,2019-11-22,Online Browsing Platform (OBP) - https://www.iso.org/obp/ui/#iso:code:3166:BN.
BN,Addition of subdivision category name in Malay; update List Source.,,2015-11-27,Online Browsing Platform (OBP) - https://www.iso.org/obp/ui/#iso:code:3166:BN.
BN,Alignment of the French short name lower case with UNTERM; update of the remarks in French.,,2014-12-18,Online Browsing Platform (OBP) - https://www.iso.org/obp/ui/#iso:code:3166:BN.
BN,Update List Source.,,2014-11-03,Online Browsing Platform (OBP) - https://www.iso.org/obp/ui/#iso:code:3166:BN.
BO,"Change of short form country name in accordance with ISO 3166-1, NL VI-6 (2009-05-08).",,2010-02-03 (corrected 2010-02-19),Newsletter II-1 - https://www.iso.org/files/live/sites/isoorg/files/archive/pdf/en/iso_3166-2_newsletter_ii-1_corrected_2010-02-19.pdf.
BO,Change of short name upper case: replace the parentheses with a coma.,,2024-02-29,Online Browsing Platform (OBP) - https://www.iso.org/obp/ui/#iso:code:3166:BO.
BO,Alignment of the English and French short names upper and lower case with UNTERM.,,2014-12-18,Online Browsing Platform (OBP) - https://www.iso.org/obp/ui/#iso:code:3166:BO.
BO,Update List Source.,,2014-11-03,Online Browsing Platform (OBP) - https://www.iso.org/obp/ui/#iso:code:3166:BO.
BO,Change of short and full names.,,2009-05-08,Online Browsing Platform (OBP) - https://www.iso.org/obp/ui/#iso:code:3166:BO.
BQ,Add new entry.,,2010-12-15,Online Browsing Platform (OBP) - https://www.iso.org/obp/ui/#iso:code:3166:BQ.
BQ,Correct the English name to Sint Eustatius in alignment with United Nations Terminology and Reference Section (UNTERM).,,2011-06-12,Online Browsing Platform (OBP) - https://www.iso.org/obp/ui/#iso:code:3166:BQ.
BQ,Correct the English name to Sint Eustatius in alignment with United Nations Terminology and Reference Section (UNTERM).,,2011-07-14,Online Browsing Platform (OBP) - https://www.iso.org/obp/ui/#iso:code:3166:BQ.
BQ,Typographical correction of subdivision name of BQ-BO in pap (deleted leading space).,,2019-11-22,Online Browsing Platform (OBP) - https://www.iso.org/obp/ui/#iso:code:3166:BQ.
BQ,Correct local short name and align with ISO 3166-2.,,2012-02-15,Online Browsing Platform (OBP) - https://www.iso.org/obp/ui/#iso:code:3166:BQ.
BQ,Change in lower case the local short name.,,2015-11-27,Online Browsing Platform (OBP) - https://www.iso.org/obp/ui/#iso:code:3166:BQ.
BQ,"Addition of code to align ISO 3166-1 and ISO 3166-2, addition of two divisions and update of the number of divisions.",,2011-12-13 (corrected 2011-12-15),Newsletter II-3 - https://www.iso.org/files/live/sites/isoorg/files/archive/pdf/en/iso_3166-2_newsletter_ii-3_2011-12-13.pdf.
BR,Correction of the Code Source.,,2020-11-24,Online Browsing Platform (OBP) - https://www.iso.org/obp/ui/#iso:code:3166:BR.
BR,Deletion of asterisk from state BR-TO; update list source.,,2016-11-15,Online Browsing Platform (OBP) - https://www.iso.org/obp/ui/#iso:code:3166:BR.
BS,Subdivisions deleted: BS-GT Green Turtle Cay.,"Correction of NL II-2 for toponyms and typographical errors, one deletion and source list update.",2011-12-13 (corrected 2011-12-15),Newsletter II-3 - https://www.iso.org/files/live/sites/isoorg/files/archive/pdf/en/iso_3166-2_newsletter_ii-3_2011-12-13.pdf.
BS,Subdivision added: BS-NP New Providence.,Addition of island BS-NP; Addition of Remark; Update List Source.,2018-11-26,Online Browsing Platform (OBP) - https://www.iso.org/obp/ui/#iso:code:3166:BS.
BS,Subdivision layout: 21 districts -> 32 districts (mistakenly listed as 31 districts in newsletter).,Update of the administrative structure and of the list source.,2010-06-30,Newsletter II-2 - https://www.iso.org/files/live/sites/isoorg/files/archive/pdf/en/iso_3166-2_newsletter_ii-2_2010-06-30.pdf.
BT,Update List Source.,,2014-11-03,Online Browsing Platform (OBP) - https://www.iso.org/obp/ui/#iso:code:3166:BT.
BT,Update List Source.,,2015-11-27,Online Browsing Platform (OBP) - https://www.iso.org/obp/ui/#iso:code:3166:BT.
BT,"Change of spelling of BT-13, BT-45; update list source.",,2016-11-15,Online Browsing Platform (OBP) - https://www.iso.org/obp/ui/#iso:code:3166:BT.
BT,Correction of the romanization system label.,,2018-11-26,Online Browsing Platform (OBP) - https://www.iso.org/obp/ui/#iso:code:3166:BT.
BT,Change of spelling of BT-43; Update List Source.,,2020-11-24,Online Browsing Platform (OBP) - https://www.iso.org/obp/ui/#iso:code:3166:BT.
BV,Modification of remark part 2. (Remark part 2: No subdivisions relevant for this standard).,,2018-11-26,Online Browsing Platform (OBP) - https://www.iso.org/obp/ui/#iso:code:3166:BV.
BV,Correct administrative language code from nbo to nob.,,2014-04-03,Online Browsing Platform (OBP) - https://www.iso.org/obp/ui/#iso:code:3166:BV.
BV,Add local short names.,,2013-02-06,Online Browsing Platform (OBP) - https://www.iso.org/obp/ui/#iso:code:3166:BV.
BW,Correction of the Code Source.,,2020-11-24,Online Browsing Platform (OBP) - https://www.iso.org/obp/ui/#iso:code:3166:BW.
BW,Subdivisions added: BW-CH Chobe. BW-FR Francistown. BW-GA Gaborone. BW-JW Jwaneng. BW-LO Lobatse. BW-SP Selibe Phikwe. BW-ST Sowa Town. Spelling changes: BW-NE North-East -> North East. BW-NW North-West -> North West. BW-SE South-East -> South East.,"Add 1 district BW-CH, 2 cities BW-FR and BW-GA, 4 towns BW-JW, BW-LO, BW-SP, BW-ST; remove hyphens from BW-NE, BW-NW, and BW-SE; update List Source.",2014-10-29,Online Browsing Platform (OBP) - https://www.iso.org/obp/ui/#iso:code:3166:BW.
BW,Subdivisions deleted: BW-CH Chobe. Codes: BW-NG Ngamiland -> BW-NW North-West.,Deletion of Chobe district which is incorporated into (new) BW-NW. Change of code element of North-West District to BW-NW. Deletion of alternative names. Update of list source.,2003-09-05,Newsletter I-5 - https://web.archive.org/web/20081218103244/http://www.iso.org/iso/iso_3166-2_newsletter_i-5_en.pdf.
BY,Correction of spelling for BY-HR of BGN/PCGN 1979.,,2020-11-24,Online Browsing Platform (OBP) - https://www.iso.org/obp/ui/#iso:code:3166:BY.
BY,Correction of the romanization system label.,,2018-11-26,Online Browsing Platform (OBP) - https://www.iso.org/obp/ui/#iso:code:3166:BY.
BY,Change romanization system from 'GOST 1983' to 'Belarusian Lacinka' of bel; change romanization system of BY-HM* of bel and rus.,,2015-11-27,Online Browsing Platform (OBP) - https://www.iso.org/obp/ui/#iso:code:3166:BY.
BY,Subdivisions added: BY-HM Horad Minsk.,Update of the administrative structure and of the list source.,2010-06-30,Newsletter II-2 - https://www.iso.org/files/live/sites/isoorg/files/archive/pdf/en/iso_3166-2_newsletter_ii-2_2010-06-30.pdf.
BY,Correction of spelling mistakes and language code elements.,,2000-06-21,Newsletter I-1 - https://www.iso.org/files/live/sites/isoorg/files/archive/pdf/en/iso_3166-2_newsletter_i-1_en.pdf.
BZ,Update List Source.,,2014-11-03,Online Browsing Platform (OBP) - https://www.iso.org/obp/ui/#iso:code:3166:BZ.
BZ,Update List Source.,,2015-11-27,Online Browsing Platform (OBP) - https://www.iso.org/obp/ui/#iso:code:3166:BZ.
CA,Name change: CA-YT Yukon Territory -> Yukon.,Change spelling of CA-YT; update List Source.,2014-10-29,Online Browsing Platform (OBP) - https://www.iso.org/obp/ui/#iso:code:3166:CA.
CA,Codes: CA-NF Newfoundland -> CA-NL Newfoundland and Labrador.,Change of code element of Newfoundland and Labrador.,2002-12-10,Newsletter I-4 - https://web.archive.org/web/20081218103210/http://www.iso.org/iso/iso_3166-2_newsletter_i-4_en.pdf.
